{
  "$schema": "./model-routing.schema.json",
  "schemaVersion": 2,
  "description": "Repo-internes, provideruebergreifend nutzbares Routing ueber logische Ausfuehrungsprofile. Es enthaelt keine Versionspins und keine Fremdprojektpfade.",
  "policy": {
    "newestStableModelPerProfile": true,
    "providerNeutralRules": true,
    "qualityOverCost": true,
    "noSilentModelSwitch": true,
    "noAutomaticDowngradeForCriticalWork": true,
    "profileAvailabilityMustBeConfirmedByRuntime": true,
    "unavailableProfileAction": "block-and-request-explicit-reroute",
    "criticalTaskCategories": [
      "security",
      "prompt-injection",
      "chess-rules",
      "pairing",
      "tiebreaks",
      "release",
      "installer",
      "pull-request-review",
      "pr-final-approval"
    ]
  },
  "qualityClassRank": {
    "local-deterministic": 10,
    "local-assist": 15,
    "standard-low-risk": 20,
    "strongest-implementation": 30,
    "strongest-planning": 40,
    "human-required": 100
  },
  "profiles": [
    {
      "id": "fabel",
      "displayName": "Fabel",
      "purpose": "Orchestrierung, Paketzerlegung, Resume- und Handoff-Koordination",
      "qualityClass": "strongest-planning",
      "allowedRisk": ["low", "medium", "high", "critical"],
      "deterministicOnly": false
    },
    {
      "id": "sol",
      "displayName": "Sol",
      "purpose": "Grosse Planung, Architektur und Finalintegration",
      "qualityClass": "strongest-planning",
      "allowedRisk": ["low", "medium", "high", "critical"],
      "deterministicOnly": false
    },
    {
      "id": "luna",
      "displayName": "Luna",
      "purpose": "Klar definierte grosse Implementierung ausserhalb kritischer Fachkategorien",
      "qualityClass": "strongest-implementation",
      "allowedRisk": ["low", "medium", "high"],
      "deterministicOnly": false
    },
    {
      "id": "terra",
      "displayName": "Terra",
      "purpose": "Risikoarme deterministische Massenarbeit",
      "qualityClass": "local-deterministic",
      "allowedRisk": ["low"],
      "deterministicOnly": true
    },
    {
      "id": "local-assist",
      "displayName": "Lokal",
      "purpose": "Read-only Zuarbeit ueber ein lokal installiertes Modell: Klassifikation, Doku-Analyse, Testideen, kleine Eingaben; nie Final- oder Fachentscheidungen",
      "qualityClass": "local-assist",
      "allowedRisk": ["low"],
      "deterministicOnly": false
    },
    {
      "id": "opus",
      "displayName": "Opus",
      "purpose": "Security, Schachregeln, Pairing/Tie-Breaks und schwierige Reviews",
      "qualityClass": "strongest-planning",
      "allowedRisk": ["low", "medium", "high", "critical"],
      "deterministicOnly": false
    },
    {
      "id": "sonnet",
      "displayName": "Sonnet",
      "purpose": "Klar abgegrenzte Implementierung mittleren Risikos",
      "qualityClass": "strongest-implementation",
      "allowedRisk": ["low", "medium"],
      "deterministicOnly": false
    }
  ],
  "selectionRules": [
    {
      "id": "critical-expert-review",
      "priority": 10,
      "taskCategories": ["security", "prompt-injection", "chess-rules", "pairing", "tiebreaks", "release", "installer", "pull-request-review", "pr-final-approval"],
      "profile": "opus",
      "minimumQualityClass": "strongest-planning",
      "reason": "Kritische Security-, Schach-, Release- oder Reviewarbeit verlangt das staerkste Expertenprofil."
    },
    {
      "id": "orchestration",
      "priority": 20,
      "workModes": ["orchestration"],
      "profile": "fabel",
      "minimumQualityClass": "strongest-planning",
      "reason": "Orchestrierung und Resume-Koordination werden ueber Fabel gefuehrt."
    },
    {
      "id": "architecture-and-final-integration",
      "priority": 30,
      "taskCategories": ["architecture", "pull-request-adoption", "final-integration"],
      "workModes": ["planning", "architecture", "final-integration", "review"],
      "profile": "sol",
      "minimumQualityClass": "strongest-planning",
      "reason": "Grosse Planung, Architektur und Finalintegration benoetigen Sol."
    },
    {
      "id": "large-planning",
      "priority": 40,
      "workModes": ["planning"],
      "sizes": ["large"],
      "profile": "sol",
      "minimumQualityClass": "strongest-planning",
      "reason": "Grosse Planungsarbeit benoetigt Sol."
    },
    {
      "id": "large-defined-implementation",
      "priority": 50,
      "workModes": ["implementation"],
      "sizes": ["large"],
      "risks": ["low", "medium", "high"],
      "profile": "luna",
      "minimumQualityClass": "strongest-implementation",
      "reason": "Klar definierte grosse Implementierung wird Luna zugeordnet."
    },
    {
      "id": "deterministic-low-risk-bulk",
      "priority": 60,
      "workModes": ["bulk"],
      "risks": ["low"],
      "requiresDeterministic": true,
      "profile": "terra",
      "minimumQualityClass": "local-deterministic",
      "reason": "Terra ist ausschliesslich fuer risikoarme deterministische Massenarbeit zugelassen."
    },
    {
      "id": "bounded-medium-implementation",
      "priority": 70,
      "workModes": ["implementation"],
      "sizes": ["small", "medium"],
      "risks": ["low", "medium"],
      "profile": "sonnet",
      "minimumQualityClass": "strongest-implementation",
      "reason": "Klar abgegrenzte Implementierung kleinen oder mittleren Umfangs wird Sonnet zugeordnet."
    },
    {
      "id": "local-assist-explicit",
      "priority": 90,
      "taskCategories": ["local-assist"],
      "risks": ["low"],
      "profile": "local-assist",
      "minimumQualityClass": "local-assist",
      "reason": "Nur ausdruecklich als local-assist markierte, risikoarme read-only Zuarbeit; andere Kategorien werden nie lokal geroutet."
    }
  ],
  "unmatchedRoute": {
    "status": "human-required",
    "reason": "Keine sichere Regel passt; Scope oder Profil muss explizit durch den Owner festgelegt werden."
  },
  "auditFields": [
    "schemaVersion",
    "taskCategory",
    "workMode",
    "size",
    "risk",
    "deterministic",
    "matchedRule",
    "recommendedProfile",
    "availabilityVerified",
    "status",
    "reason"
  ]
}
